№	Context	ART	min RT	max RT	stdev RT	ART'	min ART'	max ART'	stdev ART'
1	Отправитель наклеил на письмо	1658.267442	894.000000	3638.000000	499.425492	1501.232558	143.000000	3472.000000	522.422315
2	Кошки превосходно видят в	935.686047	320.000000	4168.000000	553.506496	866.558140	14.000000	4168.000000	584.551746
3	Перед сном бабушка выключила в комнате	1529.627907	675.000000	3121.000000	503.444770	1318.627907	395.000000	3064.000000	520.137291
4	Артисты поклонились и ушли за	1442.151163	506.000000	5789.000000	870.935056	1296.988372	108.000000	5789.000000	869.283958
5	Туристы спускались на байдарках по	1391.220930	565.000000	4450.000000	617.528916	1250.674419	239.000000	4058.000000	582.332600
6	Проводник положил лимон и сахар в	1232.164706	422.000000	5463.000000	952.603998	1100.317647	-33.000000	4910.000000	964.420048
7	Гости положили грязные тарелки в	1378.697674	276.000000	3117.000000	580.386181	1247.000000	42.000000	2665.000000	647.824668
8	Учитель написал пример мелом на	878.588235	365.000000	2029.000000	352.631647	766.623529	0.000000	2029.000000	397.708016
9	После ужина хозяйка помыла	1610.566265	906.000000	3356.000000	507.630295	1466.771084	568.000000	2887.000000	540.146916
10	В избе старуха топила	1604.081395	992.000000	3907.000000	516.799955	1448.232558	1.000000	3907.000000	575.020443
11	Моя маленькая сестрёнка увлекается лепкой из	1154.682353	401.000000	4264.000000	545.801360	1002.247059	0.000000	4264.000000	617.894985
12	Войдя в квартиру, жилец плотно закрыл	1464.988372	826.000000	3307.000000	458.417367	1315.720930	347.000000	3307.000000	491.186742
13	На новый год мы всегда украшаем	1660.547619	987.000000	4001.000000	478.818184	1551.761905	614.000000	4001.000000	521.110552
14	Певица высушила волосы с помощью	1554.767442	390.000000	4068.000000	554.876662	1394.430233	390.000000	4068.000000	612.049220
15	Бегун завязал на ботинках 	1794.290698	924.000000	9994.000000	1065.683618	1644.244186	608.000000	9820.000000	1082.375187
16	Помолившись, старушка осторожно задула	1599.600000	918.000000	3443.000000	482.884813	1435.811765	535.000000	3306.000000	589.633451
17	Все гости дружно уселись за	1074.395349	446.000000	2430.000000	357.624064	953.604651	141.000000	2430.000000	401.807776
18	Бабушка купила таблетки от головной боли в	1215.105882	398.000000	2940.000000	430.870769	1148.294118	221.000000	2940.000000	435.900923
19	Девочка гуляла по лужам и промочила	1874.058140	562.000000	4642.000000	624.960109	1760.558140	239.000000	4642.000000	699.605630
20	В семь лет дети начинают ходить в	1125.917647	12.000000	5164.000000	687.917686	1051.188235	12.000000	5164.000000	712.966764
21	Садовница поливает высохшее	1751.682353	791.000000	3739.000000	533.492518	1620.388235	435.000000	3739.000000	582.920563
22	Летом мальчик катался на двухколёсном	1805.604651	1185.000000	3292.000000	419.187233	1661.465116	809.000000	3292.000000	502.040207
23	Художник точил цветной	1590.023256	907.000000	8132.000000	920.728803	1438.034884	527.000000	7880.000000	958.990357
24	На стене висела картина в бронзовой	2196.464286	497.000000	10852.000000	1352.202839	2080.595238	497.000000	10852.000000	1355.425120
25	Выпускница надела босоножки на высоких 	1602.682353	940.000000	3474.000000	486.089797	1420.188235	587.000000	3211.000000	525.645487
26	На экзамене студент допустил досадную	1591.952941	1007.000000	2542.000000	371.383863	1475.294118	603.000000	2376.000000	393.379643
27	Начальник резко высказал своё	1439.813953	574.000000	3554.000000	581.589475	1265.406977	-346.000000	2848.000000	601.225286
28	В новом семестре студенты приступили к изучению испанского	1670.302326	994.000000	3805.000000	489.087628	1433.953488	504.000000	3805.000000	547.867629
29	Часто дети богатых родителей учатся в частных	1475.523256	854.000000	3249.000000	448.230553	1336.093023	378.000000	3249.000000	513.935419
30	Девочки хором пели весёлую	1593.569767	926.000000	3693.000000	552.808009	1496.348837	520.000000	3693.000000	593.267617
31	Именинник налил в стакан апельсиновый	1607.813953	1015.000000	3482.000000	442.037755	1498.093023	455.000000	3482.000000	493.479736
32	Брат прислушался и услышал из соседней комнаты женский	1550.776471	945.000000	3383.000000	490.568581	1400.776471	478.000000	3259.000000	552.712475
33	Начинающий актёр мечтал сняться хотя бы в каком-нибудь	1850.247059	1086.000000	4230.000000	620.071826	1730.552941	836.000000	4230.000000	647.276593
34	Марина взяла пульт и выключила надоевший	1820.790698	983.000000	5208.000000	658.540795	1609.965116	454.000000	5208.000000	689.927233
35	Сиделка сварила для больного куриный	1353.411765	843.000000	2261.000000	328.836162	1139.635294	352.000000	2261.000000	405.501977
36	Моя двоюродная сестра учится на химическом	1746.290698	1116.000000	2752.000000	387.869016	1562.895349	660.000000	2752.000000	481.840663
37	Невропатолог прописал мне успокоительные	2070.506024	1196.000000	8713.000000	938.503536	1951.759036	972.000000	8713.000000	950.405287
38	Жених подарил бриллиантовое кольцо своей	1545.593023	661.000000	4755.000000	649.453388	1418.500000	401.000000	4755.000000	673.569906
39	Сергей размешивал чай серебряной	1538.348837	169.000000	3050.000000	418.523224	1441.151163	169.000000	2952.000000	438.203432
40	Житель дома решил написать мэру анонимное	1801.616279	1064.000000	5196.000000	642.295720	1706.488372	816.000000	5196.000000	664.832376
41	По утрам почтальон неспешно разносит	1813.882353	147.000000	4408.000000	694.908908	1626.176471	147.000000	4229.000000	711.361725
42	Крестьянин вчера усердно полол	2202.686047	931.000000	7349.000000	1016.699021	2051.627907	731.000000	7349.000000	1057.636211
43	В начале занятия ученик лениво открыл	1767.406977	814.000000	3798.000000	572.949590	1628.337209	458.000000	3798.000000	607.684876
44	На лугу пастушка неумело стригла	2050.627907	980.000000	6253.000000	899.470695	1868.790698	625.000000	6076.000000	904.119710
45	Воспитанница с гувернанткой учили наизусть	1797.392857	915.000000	6557.000000	855.228808	1631.845238	470.000000	5835.000000	868.009681
46	Актриса мечтает похудеть и отказывается от	1597.710843	426.000000	5942.000000	957.310263	1249.506024	57.000000	5942.000000	997.694897
47	За старательную работу директор выплатил сотрудникам	1940.517647	1141.000000	8603.000000	1011.755212	1810.211765	691.000000	8603.000000	1045.988551
48	Сосед любит зимой кататься на	1168.476744	181.000000	3189.000000	583.721120	1039.941860	173.000000	3189.000000	597.513541
49	Отдыхающие загорали и купались в	1518.917647	527.000000	8037.000000	957.316726	1281.976471	245.000000	3904.000000	672.122189
50	Бабушка испекла вкусные пирожки с 	1262.116279	442.000000	4104.000000	601.081289	1153.302326	122.000000	3992.000000	638.720690
51	Играя в футбол, мальчик упал и сломал	1906.081395	925.000000	11501.000000	1375.028506	1834.523256	538.000000	11501.000000	1401.657403
52	Спортсмен получил травму и не принял участие в	896.488372	75.000000	3134.000000	512.734348	728.918605	43.000000	3134.000000	530.584122
53	Класс отправился с экскурсией в	1661.464286	475.000000	6214.000000	810.030766	1446.642857	101.000000	5731.000000	801.806329
54	Открывая дверь, секретарша случайно уронила	2222.400000	1040.000000	6437.000000	889.330007	2069.411765	814.000000	6437.000000	892.021504
55	В доме узбечка монотонно ткала	2729.797619	1193.000000	9252.000000	1308.502048	2563.559524	993.000000	9134.000000	1335.276844
56	Дворник выбросил обёртку в	1392.776471	109.000000	3850.000000	501.398031	1241.741176	109.000000	3393.000000	535.306636
57	Девушка вплела в волосы	2028.845238	971.000000	4266.000000	682.556225	1887.630952	554.000000	3697.000000	684.602405
58	Соседка одолжила у меня	1904.383721	787.000000	5439.000000	712.355697	1739.255814	439.000000	4865.000000	708.379745
59	Посетитель вошёл и робко сел на	1369.470588	421.000000	7269.000000	842.256897	1287.070588	421.000000	7133.000000	839.621539
60	Учитель искренне похвалил	1906.690476	587.000000	4117.000000	660.080973	1747.464286	305.000000	3583.000000	681.886088
61	После обеда Ваня допил вишнёвый	1600.255814	862.000000	2855.000000	421.759680	1517.406977	588.000000	2855.000000	445.975952
62	Тётушка распускала старомодную	3325.807229	261.000000	9299.000000	1790.902794	3114.530120	261.000000	9005.000000	1790.924740
63	Продавец доверху наполнил пластиковый	1893.883721	1082.000000	4661.000000	680.812912	1763.581395	627.000000	4661.000000	735.552317
64	После еды сержант облизал походную	2369.511628	854.000000	9765.000000	1391.535088	2214.209302	744.000000	9537.000000	1329.504588
65	Перед выходом девочка надела шерстяные	1681.534884	923.000000	2953.000000	488.096656	1558.383721	642.000000	2953.000000	512.056021
66	Бабушка замёрзла и закуталась в тёплый	1624.941176	812.000000	5079.000000	740.938648	1407.941176	387.000000	5079.000000	787.708889
67	Сестра купила в посудном магазине фарфоровую	2040.788235	1109.000000	4650.000000	699.461716	1930.729412	709.000000	4650.000000	751.086267
68	Бывшие коллеги вспоминают друг друга с горькой	3005.211765	1053.000000	10318.000000	1992.836953	2863.494118	684.000000	9798.000000	1987.167370
69	Маша связала свитер из тёплой	1846.290698	911.000000	7263.000000	846.404310	1733.093023	658.000000	6863.000000	829.531670
70	В пути пассажир читал увлекательную	1774.602410	856.000000	3576.000000	406.660371	1679.216867	148.000000	3576.000000	456.785456
71	Графиня прятала записку в деревянном	2151.905882	1161.000000	5711.000000	834.024860	1986.823529	665.000000	5387.000000	892.495447
72	Первоклассник украшал ёлку яркими	1815.104651	617.000000	3867.000000	657.220082	1699.779070	438.000000	3867.000000	697.476922
73	Музыкант играл на старинной	1975.376471	1039.000000	4988.000000	686.411805	1869.835294	751.000000	4988.000000	710.025919
74	В сентябре директор школы взял на работу нового 	1531.823529	890.000000	3105.000000	470.445260	1388.847059	459.000000	3105.000000	539.616520
75	Школьники боялись заблудиться в незнакомом	1741.662791	1091.000000	3235.000000	471.977009	1553.872093	539.000000	3235.000000	551.779257
76	Ровно в девять вечера бабушка ложится в тёплую	1556.813953	855.000000	2530.000000	393.539579	1458.046512	582.000000	2890.000000	459.369514
77	Зрители отзывались о пьесе с искренним	2117.011628	1081.000000	10554.000000	1157.771343	1929.918605	692.000000	9898.000000	1160.220894
78	Мама увлечённо выращивала комнатные	1566.581395	139.000000	3349.000000	435.714517	1374.023256	-413.000000	3349.000000	523.639098
79	За чаем друг рассказывал смешные	1433.726190	906.000000	2213.000000	285.719567	1287.119048	512.000000	2213.000000	368.630857
80	Девочка гладила пушистую	1799.290698	1023.000000	5561.000000	715.268306	1671.988372	639.000000	5561.000000	752.163304
81	В командировки военный брал с собой	2355.282353	766.000000	6320.000000	1046.117591	2273.670588	514.000000	5919.000000	1053.457972
82	По заданию педагога студент чертит	2430.406977	1150.000000	5946.000000	1087.150180	2334.244186	889.000000	5946.000000	1100.548643
83	Перед праздником секретарша украсила	2209.209302	1181.000000	5923.000000	811.276063	2020.348837	753.000000	5923.000000	862.278388
84	Кладовщик убрал ключи в	3106.675000	817.000000	9290.000000	1832.176107	3001.225000	531.000000	9290.000000	1829.949076
85	Во дворе мальчишки весело играют в	1190.081395	317.000000	3338.000000	578.493321	1099.627907	141.000000	3338.000000	609.377523
86	Неловкий официант споткнулся и пролил чай на	1421.546512	471.000000	4630.000000	676.922789	1332.813953	364.000000	4630.000000	670.717816
87	Троечник неожиданно удачно написал контрольную работу по	1287.404762	422.000000	2782.000000	467.301459	1193.190476	166.000000	2782.000000	501.772556
88	Бухгалтер нещадно критикует себя за	2018.581395	562.000000	6613.000000	1007.117067	1891.651163	501.000000	6613.000000	1013.160039
89	Консьержка раз в месяц мыла	2050.348837	930.000000	10904.000000	1190.609165	1945.558140	569.000000	10203.000000	1165.694205
90	Семейная пара мечтала следующим летом отдохнуть в	1840.802326	380.000000	6475.000000	1068.325560	1735.104651	200.000000	6218.000000	1062.034474
91	В зоопарке дети впервые увидели	1745.619048	420.000000	4015.000000	599.056747	1635.369048	222.000000	4015.000000	665.758916
92	На рынке фермер недорого продавал 	1917.282353	957.000000	3752.000000	625.262642	1775.082353	624.000000	3752.000000	674.328929
93	Посетители радостно фотографировались на фоне	2354.440476	1053.000000	7459.000000	1106.364342	2151.309524	619.000000	7459.000000	1172.950979
94	Депутат обвинил мэра в	1916.120482	519.000000	7069.000000	1111.187438	1839.349398	519.000000	7069.000000	1127.175495
95	Выходя из дома, я забыла взять 	1713.247059	746.000000	5172.000000	758.478237	1578.011765	442.000000	5172.000000	793.539261
96	Директор ещё не вернулся из	1321.953488	496.000000	5564.000000	741.961405	1152.534884	143.000000	5564.000000	738.948979
97	В этом кафе студент всегда заказывал	1895.523256	1026.000000	3912.000000	514.472150	1785.558140	675.000000	3115.000000	530.736084
98	Графиня хранила драгоценности в 	1589.211765	534.000000	8766.000000	1142.264961	1366.105882	96.000000	8766.000000	1122.354954
99	На праздник мама подарила сыну	2098.858824	852.000000	5090.000000	766.039554	1982.811765	732.000000	4542.000000	773.346646
100	Художник изобразил на картине	2248.566265	1091.000000	5903.000000	700.688741	2113.722892	988.000000	5903.000000	730.747301
101	Мы вернулись в кафе и забрали забытый	2116.388235	1073.000000	5533.000000	910.228073	1959.211765	502.000000	4832.000000	930.224270
102	Наместник императора прославился своей	2359.976190	933.000000	6975.000000	1280.033668	2152.928571	453.000000	6975.000000	1343.184382
103	Туристы восхищались живописной	2348.036145	1218.000000	7053.000000	1094.921686	2162.000000	626.000000	7053.000000	1147.676539
104	Девушка надела бордовые	2270.744186	1127.000000	5944.000000	1013.825686	2142.197674	793.000000	5739.000000	1023.195304
105	Дошкольник взял фломастер и нарисовал оранжевый	2093.302326	1011.000000	4641.000000	699.513160	1925.034884	711.000000	4641.000000	755.572996
106	Сестра волновалась перед важным	1505.047059	794.000000	4287.000000	626.417819	1422.847059	468.000000	4287.000000	664.296343
107	Из шкафа мама достала старую	2133.779070	1096.000000	7884.000000	977.731509	2014.697674	663.000000	7884.000000	990.876772
108	Вернувшись в офис после отпуска, секретарша заметила новый	2479.023256	1034.000000	8066.000000	1221.993164	2323.069767	541.000000	8066.000000	1242.854909
109	На кухне дочка доедает вкусный	1642.546512	951.000000	3343.000000	477.069921	1485.127907	557.000000	3343.000000	510.987551
110	Прохожие еле разминулись на узкой	1620.232558	900.000000	3121.000000	462.182920	1450.581395	526.000000	3121.000000	540.027025
111	В киоске продавались сувениры из светло-серой	3185.761905	1458.000000	9440.000000	1392.235756	3026.678571	1045.000000	9166.000000	1403.295237
112	Ассистент обратился за помощью к своей	2534.058824	1155.000000	7613.000000	1293.484371	2343.717647	680.000000	7613.000000	1334.945813
113	Лектор увлечённо рассказывал о недавнем	2111.505882	1110.000000	4546.000000	760.998070	1956.705882	558.000000	4281.000000	812.699423
114	Андрей устал нести тяжёлый	1772.686747	483.000000	7303.000000	926.751446	1650.843373	28.000000	7303.000000	929.536306
115	Грабители украли из квартиры ценный	2729.071429	986.000000	12173.000000	1834.774224	2603.619048	544.000000	12173.000000	1848.545067
116	Моя крестница живёт прямо напротив местного	2695.059524	1080.000000	9633.000000	1696.133891	2604.523810	608.000000	9633.000000	1728.553832
117	Ирина зашла на вещевой рынок и купила недорогую	2386.093023	1267.000000	7334.000000	1163.659225	2224.674419	598.000000	7016.000000	1194.927529
118	Парижанин с гостьей гуляли по окрестным	2518.729412	433.000000	6768.000000	1131.397423	2366.258824	433.000000	6768.000000	1039.651431
119	Анна обожала посещать субботние	2330.258824	1111.000000	6588.000000	979.755037	2179.035294	798.000000	6348.000000	986.008843
120	Всю жизнь дедушка собирал антикварные	2616.151163	1198.000000	7520.000000	1238.599727	2511.965116	880.000000	7520.000000	1211.486549
